{
  "$schema": "https://json-schema.org/draft/2020-12/schema",
  "$id": "https://skenion.dev/schemas/runtime/v0/session.schema.json",
  "title": "Skenion Runtime Session Profile v0",
  "type": "object",
  "required": ["schema", "schemaVersion", "ok", "sessionId", "lifecycle", "snapshot", "profile", "capabilities", "eventReplay", "diagnostics"],
  "properties": {
    "schema": {
      "const": "skenion.runtime.session.info"
    },
    "schemaVersion": {
      "const": "0.1.0"
    },
    "ok": {
      "type": "boolean"
    },
    "sessionId": {
      "type": "string",
      "minLength": 1
    },
    "lifecycle": {
      "$ref": "#/$defs/runtimeSessionLifecycleState"
    },
    "snapshot": {
      "$ref": "#/$defs/runtimeSessionSnapshot"
    },
    "profile": {
      "$ref": "#/$defs/runtimeConnectionProfile"
    },
    "capabilities": {
      "$ref": "#/$defs/runtimeSessionCapabilitySet"
    },
    "eventReplay": {
      "$ref": "#/$defs/runtimeEventReplayWindow"
    },
    "diagnostics": {
      "type": "array",
      "items": {
        "$ref": "#/$defs/runtimeDiagnostic"
      }
    }
  },
  "additionalProperties": false,
  "$defs": {
    "runtimeDiagnostic": {
      "type": "object",
      "required": ["severity", "message"],
      "properties": {
        "severity": {
          "enum": ["error", "warning", "info"]
        },
        "message": {
          "type": "string"
        }
      },
      "additionalProperties": false
    },
    "runtimeSessionLifecycleState": {
      "enum": ["initializing", "ready", "closing", "closed", "error"]
    },
    "runtimeConnectionProfileMode": {
      "enum": ["local-managed", "local-shared", "remote"]
    },
    "runtimeOwnershipMode": {
      "enum": ["owned-child", "external", "remote"]
    },
    "runtimeEndpointMetadata": {
      "type": "object",
      "required": ["url", "protocol"],
      "properties": {
        "url": {
          "type": "string",
          "minLength": 1
        },
        "canonicalUrl": {
          "type": "string",
          "minLength": 1
        },
        "protocol": {
          "enum": ["http", "https"]
        },
        "host": {
          "type": "string",
          "minLength": 1
        },
        "port": {
          "type": "integer",
          "minimum": 0,
          "maximum": 65535
        },
        "tls": {
          "type": "boolean"
        }
      },
      "additionalProperties": false
    },
    "runtimeProcessMetadata": {
      "type": "object",
      "required": ["ownedByHost"],
      "properties": {
        "ownedByHost": {
          "type": "boolean"
        },
        "pid": {
          "type": "integer",
          "minimum": 1
        },
        "executablePath": {
          "type": "string",
          "minLength": 1
        },
        "workingDirectory": {
          "type": "string",
          "minLength": 1
        },
        "startedAt": {
          "type": "string"
        },
        "ownerWindowId": {
          "type": "string",
          "minLength": 1
        },
        "platform": {
          "type": "string",
          "minLength": 1
        },
        "arch": {
          "type": "string",
          "minLength": 1
        }
      },
      "additionalProperties": false
    },
    "runtimeConnectionProfile": {
      "oneOf": [
        {
          "$ref": "#/$defs/runtimeLocalManagedConnectionProfile"
        },
        {
          "$ref": "#/$defs/runtimeLocalSharedConnectionProfile"
        },
        {
          "$ref": "#/$defs/runtimeRemoteConnectionProfile"
        }
      ]
    },
    "runtimeConnectionProfileBase": {
      "type": "object",
      "required": ["mode", "ownership", "endpoint"],
      "properties": {
        "mode": {
          "$ref": "#/$defs/runtimeConnectionProfileMode"
        },
        "ownership": {
          "$ref": "#/$defs/runtimeOwnershipMode"
        },
        "displayName": {
          "type": "string"
        },
        "endpoint": {
          "$ref": "#/$defs/runtimeEndpointMetadata"
        },
        "process": {
          "oneOf": [
            {
              "$ref": "#/$defs/runtimeProcessMetadata"
            },
            {
              "type": "null"
            }
          ]
        }
      },
      "additionalProperties": false
    },
    "runtimeLocalManagedConnectionProfile": {
      "allOf": [
        {
          "$ref": "#/$defs/runtimeConnectionProfileBase"
        },
        {
          "type": "object",
          "properties": {
            "mode": {
              "const": "local-managed"
            },
            "ownership": {
              "const": "owned-child"
            }
          }
        }
      ]
    },
    "runtimeLocalSharedConnectionProfile": {
      "allOf": [
        {
          "$ref": "#/$defs/runtimeConnectionProfileBase"
        },
        {
          "type": "object",
          "properties": {
            "mode": {
              "const": "local-shared"
            },
            "ownership": {
              "const": "external"
            }
          }
        }
      ]
    },
    "runtimeRemoteConnectionProfile": {
      "allOf": [
        {
          "$ref": "#/$defs/runtimeConnectionProfileBase"
        },
        {
          "type": "object",
          "properties": {
            "mode": {
              "const": "remote"
            },
            "ownership": {
              "const": "remote"
            }
          }
        }
      ]
    },
    "runtimeProjectSnapshot": {
      "type": "object",
      "required": ["graph", "viewState", "nodes"],
      "properties": {
        "graph": {
          "$ref": "https://skenion.dev/schemas/graph/v0.1/graph.schema.json"
        },
        "viewState": {
          "$ref": "https://skenion.dev/schemas/view/v0.1/view-state.schema.json"
        },
        "nodes": {
          "type": "array",
          "items": {
            "$ref": "https://skenion.dev/schemas/node/v0.1/node-definition.schema.json"
          }
        }
      },
      "additionalProperties": false
    },
    "runtimeSessionSnapshot": {
      "type": "object",
      "required": ["sessionRevision", "viewRevision", "controlRevision", "project", "diagnostics", "plan"],
      "properties": {
        "sessionRevision": {
          "type": "integer",
          "minimum": 0
        },
        "viewRevision": {
          "type": "integer",
          "minimum": 0
        },
        "controlRevision": {
          "type": "integer",
          "minimum": 0
        },
        "project": {
          "oneOf": [
            {
              "$ref": "#/$defs/runtimeProjectSnapshot"
            },
            {
              "type": "null"
            }
          ]
        },
        "diagnostics": {
          "type": "array",
          "items": {
            "$ref": "#/$defs/runtimeDiagnostic"
          }
        },
        "plan": {
          "oneOf": [
            {
              "type": "object"
            },
            {
              "type": "null"
            }
          ]
        }
      },
      "additionalProperties": false
    },
    "runtimeMutationRequest": {
      "type": "object",
      "properties": {
        "graphPatch": {
          "$ref": "https://skenion.dev/schemas/graph/v0.1/patch.schema.json"
        },
        "viewPatch": {
          "$ref": "#/$defs/runtimeViewPatch"
        },
        "clientId": {
          "type": "string",
          "minLength": 1
        },
        "description": {
          "type": "string"
        }
      },
      "additionalProperties": false
    },
    "runtimeViewPatch": {
      "type": "object",
      "required": ["baseViewRevision", "ops"],
      "properties": {
        "baseViewRevision": {
          "type": "integer",
          "minimum": 0
        },
        "ops": {
          "type": "array",
          "items": {
            "oneOf": [
              {
                "$ref": "#/$defs/runtimeSetNodeViewOperation"
              },
              {
                "$ref": "#/$defs/runtimeMoveNodeViewOperation"
              }
            ]
          }
        }
      },
      "additionalProperties": false
    },
    "runtimeSetNodeViewOperation": {
      "type": "object",
      "required": ["op", "nodeId", "view"],
      "properties": {
        "op": {
          "const": "setNodeView"
        },
        "nodeId": {
          "type": "string",
          "minLength": 1
        },
        "view": {
          "$ref": "#/$defs/runtimeCanvasNodeView"
        }
      },
      "additionalProperties": false
    },
    "runtimeMoveNodeViewOperation": {
      "type": "object",
      "required": ["op", "nodeId", "to"],
      "properties": {
        "op": {
          "const": "moveNodeView"
        },
        "nodeId": {
          "type": "string",
          "minLength": 1
        },
        "from": {
          "$ref": "#/$defs/runtimeCanvasNodeView"
        },
        "to": {
          "$ref": "#/$defs/runtimeCanvasNodeView"
        }
      },
      "additionalProperties": false
    },
    "runtimeCanvasNodeView": {
      "type": "object",
      "required": ["x", "y"],
      "properties": {
        "x": {
          "type": "number"
        },
        "y": {
          "type": "number"
        },
        "width": {
          "type": "number"
        },
        "height": {
          "type": "number"
        },
        "collapsed": {
          "type": "boolean"
        }
      },
      "additionalProperties": false
    },
    "runtimeHistoryEntry": {
      "type": "object",
      "required": ["id", "sequence", "kind", "mutation", "inverseMutation", "createdAt"],
      "properties": {
        "id": {
          "type": "string",
          "minLength": 1
        },
        "sequence": {
          "type": "integer",
          "minimum": 1
        },
        "kind": {
          "enum": ["apply", "undo", "redo"]
        },
        "mutation": {
          "$ref": "#/$defs/runtimeMutationRequest"
        },
        "inverseMutation": {
          "$ref": "#/$defs/runtimeMutationRequest"
        },
        "subjectEventId": {
          "type": "string",
          "minLength": 1
        },
        "clientId": {
          "type": "string",
          "minLength": 1
        },
        "description": {
          "type": "string"
        },
        "createdAt": {
          "type": "string",
          "minLength": 1
        }
      },
      "additionalProperties": false
    },
    "runtimeHistory": {
      "type": "object",
      "required": ["schema", "schemaVersion", "entries", "canUndo", "canRedo", "undoDepth", "redoDepth"],
      "properties": {
        "schema": {
          "const": "skenion.runtime.history"
        },
        "schemaVersion": {
          "const": "0.1.0"
        },
        "entries": {
          "type": "array",
          "items": {
            "$ref": "#/$defs/runtimeHistoryEntry"
          }
        },
        "canUndo": {
          "type": "boolean"
        },
        "canRedo": {
          "type": "boolean"
        },
        "undoDepth": {
          "type": "integer",
          "minimum": 0
        },
        "redoDepth": {
          "type": "integer",
          "minimum": 0
        }
      },
      "additionalProperties": false
    },
    "runtimeEventReplayWindow": {
      "type": "object",
      "required": ["cursorKind", "currentCursor", "earliestSequence", "latestSequence", "replayLimit"],
      "properties": {
        "cursorKind": {
          "const": "sequence"
        },
        "currentCursor": {
          "type": "string",
          "minLength": 1
        },
        "earliestSequence": {
          "type": "integer",
          "minimum": 1
        },
        "latestSequence": {
          "type": "integer",
          "minimum": 0
        },
        "replayLimit": {
          "oneOf": [
            {
              "type": "integer",
              "minimum": 0
            },
            {
              "type": "null"
            }
          ]
        },
        "overflow": {
          "type": "boolean"
        }
      },
      "additionalProperties": false
    },
    "runtimeSessionCapabilitySet": {
      "type": "object",
      "required": ["sessionAddressing", "defaultSessionAlias", "eventReplay", "multiWindow", "profiles", "authPolicy"],
      "properties": {
        "sessionAddressing": {
          "type": "boolean"
        },
        "defaultSessionAlias": {
          "type": "boolean"
        },
        "eventReplay": {
          "type": "boolean"
        },
        "multiWindow": {
          "type": "boolean"
        },
        "profiles": {
          "type": "array",
          "items": {
            "$ref": "#/$defs/runtimeConnectionProfileMode"
          }
        },
        "authPolicy": {
          "const": "deferred"
        }
      },
      "additionalProperties": false
    },
    "runtimeEventReplayGap": {
      "type": "object",
      "description": "Gap metadata reports a missed retained range. expectedSequence must be less than actualSequence.",
      "required": ["expectedSequence", "actualSequence", "reason"],
      "properties": {
        "expectedSequence": {
          "type": "integer",
          "minimum": 1
        },
        "actualSequence": {
          "type": "integer",
          "minimum": 1
        },
        "reason": {
          "enum": ["retention-overflow", "stream-reset", "unknown"]
        }
      },
      "additionalProperties": false
    },
    "runtimeEventReplayMetadata": {
      "type": "object",
      "required": ["cursor", "previousCursor", "replayed", "gap", "overflow"],
      "properties": {
        "cursor": {
          "type": "string",
          "minLength": 1
        },
        "previousCursor": {
          "oneOf": [
            {
              "type": "string",
              "minLength": 1
            },
            {
              "type": "null"
            }
          ]
        },
        "replayed": {
          "type": "boolean"
        },
        "gap": {
          "oneOf": [
            {
              "$ref": "#/$defs/runtimeEventReplayGap"
            },
            {
              "type": "null"
            }
          ]
        },
        "overflow": {
          "type": "boolean"
        }
      },
      "additionalProperties": false
    },
    "runtimeSessionEventKind": {
      "enum": ["snapshot", "load", "clear", "mutate", "undo", "redo"]
    },
    "runtimeSessionEvent": {
      "type": "object",
      "required": ["schema", "schemaVersion", "id", "sessionId", "sequence", "sessionRevision", "kind", "snapshot", "history", "replay", "diagnostics", "createdAt"],
      "properties": {
        "schema": {
          "const": "skenion.runtime.session.event"
        },
        "schemaVersion": {
          "const": "0.1.0"
        },
        "id": {
          "type": "string",
          "minLength": 1
        },
        "sessionId": {
          "type": "string",
          "minLength": 1
        },
        "sequence": {
          "type": "integer",
          "minimum": 1
        },
        "sessionRevision": {
          "type": "integer",
          "minimum": 0
        },
        "kind": {
          "$ref": "#/$defs/runtimeSessionEventKind"
        },
        "snapshot": {
          "$ref": "#/$defs/runtimeSessionSnapshot"
        },
        "history": {
          "$ref": "#/$defs/runtimeHistory"
        },
        "mutation": {
          "$ref": "#/$defs/runtimeHistoryEntry"
        },
        "replay": {
          "$ref": "#/$defs/runtimeEventReplayMetadata"
        },
        "diagnostics": {
          "type": "array",
          "items": {
            "$ref": "#/$defs/runtimeDiagnostic"
          }
        },
        "createdAt": {
          "type": "string",
          "minLength": 1
        }
      },
      "additionalProperties": false
    }
  }
}
