{
  "schema": "skenion.runtime.session.info",
  "schemaVersion": "0.1.0",
  "ok": true,
  "sessionId": "session-shared",
  "lifecycle": "ready",
  "snapshot": {
    "sessionRevision": 3,
    "viewRevision": 1,
    "controlRevision": 1,
    "project": null,
    "diagnostics": [],
    "plan": null
  },
  "profile": {
    "mode": "local-shared",
    "ownership": "external",
    "displayName": "Shared local runtime",
    "endpoint": {
      "url": "http://127.0.0.1:49232",
      "canonicalUrl": "http://127.0.0.1:49232",
      "protocol": "http",
      "host": "127.0.0.1",
      "port": 49232,
      "tls": false
    },
    "process": {
      "ownedByHost": false,
      "pid": 41000,
      "platform": "darwin",
      "arch": "aarch64"
    }
  },
  "capabilities": {
    "sessionAddressing": true,
    "defaultSessionAlias": true,
    "eventReplay": true,
    "multiWindow": true,
    "profiles": ["local-managed", "local-shared", "remote"],
    "authPolicy": "deferred"
  },
  "eventReplay": {
    "cursorKind": "sequence",
    "currentCursor": "3",
    "earliestSequence": 1,
    "latestSequence": 3,
    "replayLimit": 512,
    "overflow": false
  },
  "diagnostics": []
}
