{
  "schema": "skenion.runtime.session.info",
  "schemaVersion": "0.1.0",
  "ok": true,
  "sessionId": "session-a",
  "lifecycle": "ready",
  "snapshot": {
    "sessionRevision": 7,
    "viewRevision": 2,
    "controlRevision": 4,
    "project": null,
    "diagnostics": [],
    "plan": null
  },
  "profile": {
    "mode": "local-managed",
    "ownership": "owned-child",
    "displayName": "Managed local runtime",
    "endpoint": {
      "url": "http://127.0.0.1:49231",
      "canonicalUrl": "http://127.0.0.1:49231",
      "protocol": "http",
      "host": "127.0.0.1",
      "port": 49231,
      "tls": false
    },
    "process": {
      "ownedByHost": true,
      "pid": 41820,
      "executablePath": "/Applications/Skenion Studio.app/Contents/Resources/skenion-runtime",
      "workingDirectory": "/var/folders/skenion/session-a",
      "startedAt": "2026-06-22T00:00:00.000Z",
      "ownerWindowId": "window-a",
      "platform": "darwin",
      "arch": "aarch64"
    }
  },
  "capabilities": {
    "sessionAddressing": true,
    "defaultSessionAlias": true,
    "eventReplay": true,
    "multiWindow": true,
    "profiles": ["local-managed", "local-shared", "remote"],
    "authPolicy": "deferred"
  },
  "eventReplay": {
    "cursorKind": "sequence",
    "currentCursor": "7",
    "earliestSequence": 1,
    "latestSequence": 7,
    "replayLimit": 512,
    "overflow": false
  },
  "diagnostics": []
}
